projectname,classification,preprocess_comments
jruby-1.4.0,1,basic ignor protocol let someon report it
jruby-1.4.0,1,sss fixm thi correct
jruby-1.4.0,1,fixm use block implement end node becaus need proc which captur it enclos scope forblock now repres these node and should renam
jruby-1.4.0,1,sss fixm order correct poll befor next
jruby-1.4.0,1,use highli uncommon string repres paragraph delimit soln not worth it
jruby-1.4.0,1,add self recv here todo thi right
jruby-1.4.0,1,todo mri behavior call add depend call but thi lead except when float ad see return op true thi mri behavior we use our now thu provid abil add float
jruby-1.4.0,1,sss fixm thi correctli place end loop iter
jruby-1.4.0,1,todo rubi reus thi logic other write behavior check it and call write again
jruby-1.4.0,1,sss fixm where doe thi go
jruby-1.4.0,1,would nice and logic expon form behav like and decim form behav like but such luck henc
jruby-1.4.0,1,sss fixm these should get normal compil initi some other way sss fixm parent super type info incorrect these just placehold now thi need updat with real class object later
jruby-1.4.0,1,todo probabl here confirm jrubi
jruby-1.4.0,1,sss fixm could make ir loop scope too semant scope but function not sure thi requir yet
jruby-1.4.0,1,thi cover rare case lower case class name and thu will fail time fortun we onli thi onc per packag name and serious folk look into best practic
jruby-1.4.0,1,sss fixm should thi string liter string dummi class script
jruby-1.4.0,1,todo should thi deprec to effici intern should deal with rubyhash directli
jruby-1.4.0,1,sss fixm doe int suffic need long
jruby-1.4.0,1,modul includ with shim class must find that shim handl super appropri
jruby-1.4.0,1,reset valu map thi instruct start end basic block right now call consid hard boundari optim and inform cannot propag across them sss fixm rather than treat all call with broad brush what need captur differ attribut about call use closur known call target can modifi scope etc thi inform probabl alreadi present ast inspector
jruby-1.4.0,1,todo determin whether should perhap store non singleton class implementationclass
jruby-1.4.0,1,sss fixm correct where doe closur arg come from
jruby-1.4.0,1,fixm consid fix node assign itself rather than singl case
jruby-1.4.0,1,sss fixm should have refer ir loop that be retri
jruby-1.4.0,1,temporari hack handl non rubi valu will come with better solut shortli
jruby-1.4.0,1,simplifi variabl too keep these variabl sync with what actual use when claus thi not requir correct reason but onli perform reason
jruby-1.4.0,1,must call from main thread it current but thi bother me
jruby-1.4.0,1,con fixm don know how make case express doe that logic need here
jruby-1.4.0,1,fixm legal here may want
jruby-1.4.0,1,fixm thi ugli hack resolv jrubi not proud
jruby-1.4.0,1,someth wrong don know cwd todo thi behavior realli desir mov
jruby-1.4.0,1,todo java stringiti
jruby-1.4.0,1,fixm total hack get flash rail session ok we need total chang marshal work with overridden core class
jruby-1.4.0,1,todo thi method not present mri
jruby-1.4.0,1,fixm ideal javaobject instanc should marshal which mean that javaobject metaclass should have appropri alloc jrubi
jruby-1.4.0,1,todo public onli
jruby-1.4.0,1,fixm thi should probabl some translat from rubi prioriti level java prioriti level until have green thread
jruby-1.4.0,1,todo consid better way synchron
jruby-1.4.0,1,use ioinputstream may not most perform way but it easi
jruby-1.4.0,1,fixm should not regener thi over and over
jruby-1.4.0,1,xxx thi check previous use callmethod check equal between class when scan hierarchi howev check may safe should onli ever have one instanc bound given type constant it found unsaf examin way avoid call
jruby-1.4.0,1,todo probabl here confirm jrubi
jruby-1.4.0,1,todo whi duplic constant here and then file constant below file constant includ io
jruby-1.4.0,1,clone method now belong new class set it todo make dynamicmethod immut
jruby-1.4.0,1,todo these miss we not handl them elsewher
jruby-1.4.0,1,todo cach
jruby-1.4.0,1,fixm wtf thi whi would these use class
jruby-1.4.0,1,todo figur out how thi can happen and possibl remov
jruby-1.4.0,1,fixm don like thi
jruby-1.4.0,1,fixm these descript should probabl move out constantin project which deal with all platform depend constant
jruby-1.4.0,1,fixm thi below temporari but it much safer cow it prevent not share string with begin thi allow now bytelist set not begin awar
jruby-1.4.0,1,todo what about arg
jruby-1.4.0,1,fixm think thi chunk equival mri idnam and not our public method idnam make into method use more than onc
jruby-1.4.0,1,todo cach
jruby-1.4.0,1,fixm thi probabl not veri effici sinc load all method each call
jruby-1.4.0,1,hack replac usual readlin with thi
jruby-1.4.0,1,get here found match method use todo choos narrowest method continu search
jruby-1.4.0,1,todo thi kinda gross
jruby-1.4.0,1,fixm order thread play well with standard behavior must provid alloc that can creat empti object instanc which initi then fill with appropri data
jruby-1.4.0,1,these extra array realli unfortun split some these path out elimin
jruby-1.4.0,1,clone dynam scope becaus thi will new instanc block ani previous captur instanc thi block may still around and not want start overwrit those valu when creat new one enebo onc make self lastclass and lastmethod immut can remov duplic
jruby-1.4.0,1,todo protect method thi go requir rework some mechan
jruby-1.4.0,1,not overload add method that guess which signatur use todo just ad first one right now add signatur guess logic
jruby-1.4.0,1,sss fixm thi should never get call constant svalu
jruby-1.4.0,1,todo thi version better than hackish previou one window behavior need defin though suppos thi version could improv more too todo etc passwd also inadequ macosx sinc doe not use etc passwd regular user account
jruby-1.4.0,1,fixm there some code duplic here with rubyobject inspect
jruby-1.4.0,1,visibl check without requir frame self todo don bother pass when fcall vcall and adjust callsit appropri
jruby-1.4.0,1,fixm figur out whi get null sometim
jruby-1.4.0,1,hacki advanc posit eat newlin here
jruby-1.4.0,1,need reexamin thi
jruby-1.4.0,1,fixm thi current onli here becaus some problem with iooutputstream write bare runtim without proper scope
jruby-1.4.0,1,workaround jrubi
jruby-1.4.0,1,use iooutputstream may not most perform way but it easi
jruby-1.4.0,1,ignor bean doesn get regist todo whi doe that bother me
jruby-1.4.0,1,todo probabl here confirm jrubi
jruby-1.4.0,1,enebo lot optz parser here
jruby-1.4.0,1,fixm move out thi class
jruby-1.4.0,1,fact should probabl rais error ye
jruby-1.4.0,1,todo ari sort check should done here
jruby-1.4.0,1,todo get rid thi lax return strict will throw
jruby-1.4.0,1,bit riski someon chang completor but use method call
jruby-1.4.0,1,todo rest thi seek same posit unnecessari sinc share channel but some thi may need
jruby-1.4.0,1,todo thi right thing do
jruby-1.4.0,1,fixm thi probabl belong differ packag
jruby-1.4.0,1,fixm not veri effici
jruby-1.4.0,1,clone dynam scope becaus thi will new instanc block ani previous captur instanc thi block may still around and not want start overwrit those valu when creat new one enebo onc make self lastclass and lastmethod immut can remov duplic
jruby-1.4.0,1,thi gross but java api aren iso compliant all
jruby-1.4.0,1,todo thi correct
jruby-1.4.0,1,workaround jrubi mri doe not enter thi product some reason
jruby-1.4.0,1,creat block thi iter node fixm shouldn use current scope it not actual from same hierarchi static scope
jruby-1.4.0,1,sss fixm need check same whatev pop
jruby-1.4.0,1,sss fixm where thi set up how thi diff from classvardeclnod
jruby-1.4.0,1,fixm need check doe main java not call thi they should consolid
jruby-1.4.0,1,fixm thi tabl will get move into posix librari can get all actual support signal thi quick fix support basic signal until that happen
jruby-1.4.0,1,fixm thi worri bit sinc could alloc lot with larg newlength
jruby-1.4.0,1,todo thi filter kind gross it would nice get some parser help here
jruby-1.4.0,1,todo decompos don pars fullnam
jruby-1.4.0,1,thi gross but java api aren iso compliant all
jruby-1.4.0,1,fixm get rid lazi and handl restrict access elsewher
jruby-1.4.0,1,todo now use faith reimplement mri algorithm but should use utfencod facil from joni onc start prefrom utf content valid
jruby-1.4.0,1,don have opt arg start after arg they will assign later thi crap like def foo true which number befor fixm onli start after requir arg sinc opt arg may access other and rest arg conflict with compileroot use indic signatur
jruby-1.4.0,1,fixm determin real alloc need here peopl want extend javaclass want them that can you should you abl to todo probabl here sinc don intend peopl monkey with thi type and can marshal confirm jrubi
jruby-1.4.0,1,grrr arghh want subclass but can must all thi the next line code which ha alreadi been done floatingdecim
jruby-1.4.0,1,fixm realli want method includ privat protect and doe not includ superclass method also getdeclar call may throw securityexcept we run under restrict secur polici
jruby-1.4.0,1,small hack save cast later
jruby-1.4.0,1,thi perhap inneffici timewis optim spacewis
jruby-1.4.0,1,todo confirm expect arg irubyobject or similar
jruby-1.4.0,1,there not compel reason keep javaclass instanc weak map ani proxi creat were kept non weak map most case they will stick around anyway and some good reason not javaclass creation expens one mani lookup perform when pass paramet to from method etc todo faster custom concurr map
jruby-1.4.0,1,todo check java reserv name and rais except encount
jruby-1.4.0,1,fixm jrubi end with condit return null quick fix until can dig into
jruby-1.4.0,1,workaround bug sun jdk see
jruby-1.4.0,1,fixm weakref rb also doe caller here backtrac
jruby-1.4.0,1,fixm remov thi from grammar
jruby-1.4.0,1,todo it perhap just coincid that all channel which should rais instanceof selectablechannel sinc stdio not so thi bother slightli con
jruby-1.4.0,1,fixm not sure what semant transfer
jruby-1.4.0,1,fixm thi pretti gross should have cleaner initi that doesn depend packag visibl field and ideal atom probabl use immut structur replac all onc lazi null when group defin
jruby-1.4.0,1,thi dummi scope should find way make that more explicit
jruby-1.4.0,1,fixm resolv what hell go on
jruby-1.4.0,1,rb obj id return intern object fixm should thi renam match it rubi name
jruby-1.4.0,1,again shouldn happen todo might want throw except instead
jruby-1.4.0,1,fixm mayb not best place but move good home
jruby-1.4.0,1,todo may here but it unclear how struct work with marshal confirm behavior and ensur we do thi correctli jrubi
jruby-1.4.0,1,todo should next and return also catch here
jruby-1.4.0,1,alway prepend org jrubi proxi packag begin becaus java and javax packag protect and sign jar prevent gener new class with those packag name see jrubi
jruby-1.4.0,1,todo should abl optim thi quit bit post javaclass alreadi ha all method organ method name next version support protect method field will have them organ even further collectmethod here can just lookup overridden method javaclass map should much faster
jruby-1.4.0,1,index item thi could probabl more effici bail out assign arg past end
jruby-1.4.0,1,todo make more effici not creat irubyarray
jruby-1.4.0,1,rb mod remov cvar fixm ani good reason have two ident method same
jruby-1.4.0,1,from dup setup from dup setup here unlik
jruby-1.4.0,1,don have opt arg start after arg they will assign later thi crap like def foo true which number befor fixm onli start after requir arg sinc opt arg may access other and rest arg conflict with compileroot use indic signatur
jruby-1.4.0,1,it singl arg when but contain array know it real liter array fixm thi gross way figur out parser help similar yield argument pass expandargu would better
jruby-1.4.0,1,todo onli setaccess account pattern found access constant includ from non public interfac aka be implement mani class
jruby-1.4.0,1,not intend call directli user privat old todo from rubi code thi should implement javaclass java where can check reserv rubi name conflict method etc
jruby-1.4.0,1,fixm don allow multipl thread thi onc
jruby-1.4.0,1,todo bleed runtim into parser ariti may should parser to keep bleed oneway
jruby-1.4.0,1,rb ari push fixm whi thi name push
jruby-1.4.0,1,todo thi probabl isn best hack but work until can have differ root frame setup easili
jruby-1.4.0,1,todo least pass argsnod null implicitnil wrong magic setuparg sinc will irubyobject nil need figur out nice fast null pattern setuparg assert argsnod null receivernod not null
jruby-1.4.0,1,hack order have stdout err act like tti and flush alway set anyth assign stdout stderr sync
jruby-1.4.0,1,fixm not veri effici
jruby-1.4.0,1,todo peopl extend gzipwrit reader will break find better way here
jruby-1.4.0,1,fixm set call configur thi
jruby-1.4.0,1,process stream get into filechannel but not actual seekabl instead just isseek check do instanceof filechannel must also add thi boolean check which set fals when it known that incom channel from process fixm thi gross and it nio fault not provid nice way to tell channel realli seekabl
jruby-1.4.0,1,again shouldn happen todo might want throw except instead
jruby-1.4.0,1,fixm somehow feel better thi could get appropri var index from argumentnod
jruby-1.4.0,1,fixm can get optim ieqlnod
jruby-1.4.0,1,todo round mode should not hard code see mode
jruby-1.4.0,1,fixm move thi here get what obvious util method out irubyobject perhap secur method should find their own central home some point
jruby-1.4.0,1,fixm nativeexcept expect use from rubi code should provid real alloc use otherwis class new will fail will marshal jrubi
jruby-1.4.0,1,object to obsolet match rubi hack until to goe away then can remov thi hack too
jruby-1.4.0,1,todo callback valu would more effici but unlik big cost constant rare assign
jruby-1.4.0,1,fixm thi should somewher more gener mayb idutil
jruby-1.4.0,1,sss fixm move thi code some util area probabl there alreadi method thi some jrubi util class holi cow just append two darn array
jruby-1.4.0,1,todo set our metaclass target class scari
jruby-1.4.0,1,add with full signatur it guarante directli access todo need thi full formal jvm signatur
jruby-1.4.0,1,context null wipe out softrefer thi could done with refer queue
jruby-1.4.0,1,todo remov
jruby-1.4.0,1,fixm not veri effici
jruby-1.4.0,1,fixm big fat hack here becaus scope name expect intern string parser
jruby-1.4.0,1,todo thi actual now return scope whoever call method to proc which obvious wrong but there scope provid mani method fix jrubi but need better solut
jruby-1.4.0,1,author headiu fixm convert enum
jruby-1.4.0,1,the follow three method must defin fast sinc they expect modifi current frame they expect frame will alloc them jrubi
jruby-1.4.0,1,todo probabl here sinc don intend peopl monkey with thi type and can marshal confirm jrubi
jruby-1.4.0,1,sss fixm can thi return anyth other than nil
jruby-1.4.0,1,xxx const lookup can trigger const miss that enough warrant alway be execut
jruby-1.4.0,1,visibl check without requir frame self todo don bother pass when fcall vcall and adjust callsit appropri
jruby-1.4.0,1,todo should frozen error have it own distinct class not should more share
jruby-1.4.0,1,todo onli use interfac implement elimin
jruby-1.4.0,1,fixm null check remov onc figur out how assign unset name block arg
jruby-1.4.0,1,for jrubi when met choos cet timezon work around joda
jruby-1.4.0,1,fixm thi gross don thi
jruby-1.4.0,1,fixm think need these push somewher
jruby-1.4.0,1,sss fixm deprec go forward all instruct should come from cfg
jruby-1.4.0,1,todo should probabl appli null object pattern non allow class rather than null
jruby-1.4.0,1,todo should next and return also catch here
jruby-1.4.0,1,yow thi still ugli
jruby-1.4.0,1,add method with full signatur it guarante directli access todo need thi full formal jvm signatur
jruby-1.4.0,1,fixm thi version faster than previou but both suffer from crucial flaw imposs creat objectspac with iter that doesn either hold object that might otherwis collect have way guarante that call hasnext will correct or that subsequ call next will produc object for our purpos now thi may accept
jruby-1.4.0,1,fixm clear read buffer here is thi appropri
jruby-1.4.0,1,todo specifi soft ref may want compar memori consumpt behavior with weak ref specifi weak place soft below
jruby-1.4.0,1,fixm lose syntact element here and other like thi
jruby-1.4.0,1,enebo total weird name in mri not alloc and local var name
jruby-1.4.0,1,fixm thi doesn actual support anyth but string
jruby-1.4.0,1,ten stuff into tmp local load revers order and assign fixm there probabl slightli smarter way but import
jruby-1.4.0,1,xxx someth
jruby-1.4.0,1,todo onli setaccess account pattern found access constant includ from non public interfac aka be implement mani class todo not sure need thi all sinc onli expos public field
jruby-1.4.0,1,fixm want elimin these type cast when possibl
jruby-1.4.0,1,todo decompos don pars fullnam
jruby-1.4.0,1,hack forc clinit creat
jruby-1.4.0,1,fixm true array common enough should pre alloc and stick somewher
jruby-1.4.0,1,option arg have irubyobject todo confirm
jruby-1.4.0,1,todo thi almost metaclass perhap refactor
jruby-1.4.0,1,fixm ad thi becaus marshal spec seem reconstitut object without call datawrapstruct thi result object be null after unmarshal
jruby-1.4.0,1,todo factor thi chunk mri yarv getast
jruby-1.4.0,1,todo ari sort check should done here
jruby-1.4.0,1,exit monitor befor make call fixm thi not be final littl worrisom
jruby-1.4.0,1,self arg sss fixm verifi that thi correct
jruby-1.4.0,1,thi jrubi sinc after suspend termin seem need reiniti sinc can easili detect suspens initi after everi readlin probabl not fast but thi interact termin anyway so who care
jruby-1.4.0,1,todo abov but not below addit newlin node
jruby-1.4.0,1,sss fixm receiv thi class meta object basic operand receiv
jruby-1.4.0,1,fixm thi whole thing could probabl implement modul and mix into appropri class especi use either smart about kind io like object it be use against
jruby-1.4.0,1,fixm bit kludg here non interfac class assign both class and modul field simplifi proxi extend code will away when overhaul and proxi extend deprec
jruby-1.4.0,1,fixm what should these realli be numer assert instanceof rubycomplex instanceof rubycomplex
jruby-1.4.0,1,we depend side effect load which load class but doe not turn into script don like it but until restructur code bit more we need quietli let here
jruby-1.4.0,1,fixm should also support org that use capit packag name includ embarrassingli one work for but thi should enabl system properti expect default behavior upper case valu should and is treat class name and rais except it not found
jruby-1.4.0,1,index item thi could probabl more effici bail out assign arg past end
jruby-1.4.0,1,todo thi version differ from ioctl check whether fcntl exist and rais notimpl doesn perhap differ us
jruby-1.4.0,1,fixm thi temporari sinc variabl compil assum want arg alreadi stack assign just pop and continu with arg logic
jruby-1.4.0,1,todo elimin
jruby-1.4.0,1,todo confirm expect arg irubyobject or similar
jruby-1.4.0,1,todo handl write into origin buffer better
jruby-1.4.0,1,thi fairli specif hack empti string but doe job
jruby-1.4.0,1,xxx thi constructor hack implement end syntax convert reader back into inputstream doesn gener work
jruby-1.4.0,1,method ha more than line we need split and therefor need use heap base scope
jruby-1.4.0,1,the implement these all bonu see todo abov go throw error from these but appear wrong place it
jruby-1.4.0,1,todo confirm expect arg irubyobject or similar
jruby-1.4.0,1,entri exist proxi doesn match replac thi could happen old proxi gc todo rais except store proxi non null not gc
jruby-1.4.0,1,todo better algorithm set precis need
jruby-1.4.0,1,sss fixm use anywher don see call thi anywher public operand node ir scope dasgnnod dasgnnod dasgnnod node
jruby-1.4.0,1,todo make thi more intellig valu
jruby-1.4.0,1,todo split thi into two sub class that name and constnod can specifi seper
jruby-1.4.0,1,not sure how well thi work but work much better than just currenttimemilli itself
jruby-1.4.0,1,fixm thi copi code from rubyarray both re struct and array should share one impl thi also hacki sinc construct rubi object access rubi array through aref instead someth lower
jruby-1.4.0,1,fixm no don like it
jruby-1.4.0,1,ignor bean doesn get regist todo whi doe that bother me
jruby-1.4.0,1,fixm thi current onli here becaus some problem with iooutputstream write bare runtim without proper scope
jruby-1.4.0,1,argument compil alway creat irubyobject but want use rubyarray concat here fixm result thi not effici sinc creat and then later unwrap array
jruby-1.4.0,1,sss fixm what differ between classvarasgnnod classvardeclnod
jruby-1.4.0,1,fixm set callconfigur thi
jruby-1.4.0,1,todo read write from frame todo inform scope todo visibl
jruby-1.4.0,1,fixm somehow feel better thi could get appropri var index from argumentnod
jruby-1.4.0,1,fixm thi almost entir duplic from main java
jruby-1.4.0,1,might need perform dst correct
jruby-1.4.0,1,fixm thi current onli here becaus some problem with iooutputstream write bare runtim without proper scope
jruby-1.4.0,1,creat block thi iter node fixm shouldn use current scope it not actual from same hierarchi static scope
jruby-1.4.0,1,fixm how much more obtus can thi be heredoc alreadi pars thi and save string do not pars just return
jruby-1.4.0,1,thi need split sinc condit call inherit doesn fit standard rubi semant
jruby-1.4.0,1,xxx again screwi eval under previou frame scope
jruby-1.4.0,1,sss fixm mayb thi not realli concern after all nest level thi scope lexic nest scope current file thi not confus with semant nest scope across file consid thi code file class end so lexic nest level the file script file semant level thi primarili use ensur that variabl name don clash definit closur shouldn overrid use from parent scope privat int
jruby-1.4.0,1,ignor bean doesn get regist todo whi doe that bother me
jruby-1.4.0,1,actual type doe not exactli match method return type re get convert fixm when onli autoconvers primit thi won need
jruby-1.4.0,1,fixm should probabl still dyncal here
jruby-1.4.0,1,fixm final should dup here
jruby-1.4.0,1,don bother check final method won there not gener can be
jruby-1.4.0,1,todo gener thi type check code into irubyobject helper
jruby-1.4.0,1,fixm need rethought
jruby-1.4.0,1,rubi constant string should thi move somewher els
jruby-1.4.0,1,let onli gener method those user may actual intend overrid that includ ani defin current class and ani ancestor that also javaproxyclass but none from ani other ancestor class method defin mixin will consid intent overridden except those from kernel java and javaproxymethod well enumer todo may want exclud other common mixin
jruby-1.4.0,1,fixm don like null check here
jruby-1.4.0,1,invok callmethodmiss method directli todo thi could further optim sinc some dsl hit method miss pretti hard
jruby-1.4.0,1,todo confirm expect arg irubyobject or similar
jruby-1.4.0,1,todo thi realli ineffi and potenti problem everytim anyon requir someth should tri make loadpath special array object
jruby-1.4.0,1,get here found match method use todo choos narrowest method continu search
jruby-1.4.0,1,rb obj id return intern object fixm should thi renam match it rubi name
jruby-1.4.0,1,fixm whi thi use befor that did callsup
jruby-1.4.0,1,bodi rescu node inspect it piec separ avoid disabl all optz todo thi gross
jruby-1.4.0,1,fixm thi doe not have exact same semant rubyarray join but they probabl could consolid perhap join arg sep dochomp
jruby-1.4.0,1,lame gener issu make segment class static and manual insert cach refer work around variou problem gener referenc method var across class
jruby-1.4.0,1,fixm not veri effici
jruby-1.4.0,1,fixm thi determin modul strang locat and should somehow block
jruby-1.4.0,1,todo think thi end propag from normal java except
jruby-1.4.0,1,thi seem unlik happen unless it total bogu fileno so even need bother tri creat one
jruby-1.4.0,1,todo turn off neg will return lax mode
jruby-1.4.0,1,todo list sublist from to clear suppos clear sublist from list how can support thi oper
jruby-1.4.0,1,sss fixm what differ between classvarasgnnod classvardeclnod
jruby-1.4.0,1,see note below re field kludg
jruby-1.4.0,1,we not set provid anyth but seem that bouncycastl doe some intern thing it provid constructor which requir execut secur context ideal thi hack should remov see jrubi and thi bug
jruby-1.4.0,1,thi rather ugli hack but similar mri see hash rubi setenv and similar mri search all key case insensit match and use that
jruby-1.4.0,1,todo wrong get interfac from class
jruby-1.4.0,1,todo make callcoerc work block context then fix downto step and upto
jruby-1.4.0,1,fixm code below copi rubyio put and should avoid copi past
jruby-1.4.0,1,instal invokedynam bootstrapp todo need abstract thi setup behind anoth compil interfac
jruby-1.4.0,1,fixm ineffici construct bignum just dump
jruby-1.4.0,1,todo rubi doe not seem care about invalid numer mode valu not sure rubi overflow here also
jruby-1.4.0,1,fixm obviou issu that not all platform can display all attribut ugli hack use gener posix librari make push inspect behavior into specif system impl rather pain
jruby-1.4.0,1,from dup setup here unlik
jruby-1.4.0,1,fixm thi realli ought clinit but doesn matter much
jruby-1.4.0,1,todo callback valu would more effici but unlik big cost constant rare assign
jruby-1.4.0,1,use iochannel may not most perform way but it easi
jruby-1.4.0,1,todo thi should entri into error handl somewher
jruby-1.4.0,1,todo make thi specif ariti call
jruby-1.4.0,1,fixm legal here may want
jruby-1.4.0,1,fixm thi ugli hack resolv jrubi not proud
