projectname,classification,preprocess_comments
jruby-1.4.0,0,creat one extra dynamicscop bind that when bind will get put into thi new dynam scope the origin scope doe not see new and success eval with thi bind will take have abil have succes bind eval abl share same scope make sens from programm perspect one crappi outcom thi design requir dynam and static scope mutabl thi one case
jruby-1.4.0,0,expect
jruby-1.4.0,0,variabl live entri thi node variabl live exit node temporari set live variabl size in and out bit set
jruby-1.4.0,0,ignor backslash space
jruby-1.4.0,0,must have been load from our known classload hierarchi
jruby-1.4.0,0,invert sign sinc format and java format use opposit sign sigh also java api requir sign alway present
jruby-1.4.0,0,irubyobject dynamicmethod threadcontext irubyobject rubyclass string irubyobject
jruby-1.4.0,0,taint here ever want it secur
jruby-1.4.0,0,thread pool use execut thi runtim rubi thread
jruby-1.4.0,0,append directori strip off text befor rubi line and perhap directori
jruby-1.4.0,0,note that thi object equal check intent ensur string and it intern version same object
jruby-1.4.0,0,rb match busi
jruby-1.4.0,0,assert internedsymbol internedsymbol not intern
jruby-1.4.0,0,allow proxi read without synchron proxi under construct onli build thread can see it
jruby-1.4.0,0,doe thi instruct have side effect result it oper thi inform use optim phase impact dead code elimin and other optim pass
jruby-1.4.0,0,construct local variabl base paramet name pass
jruby-1.4.0,0,ani except rais fail
jruby-1.4.0,0,alway need least
jruby-1.4.0,0,we run from within ide may not have rb file our classpath tri find them filesystem instead
jruby-1.4.0,0,error string
jruby-1.4.0,0,extra arg rest
jruby-1.4.0,0,block
jruby-1.4.0,0,line
jruby-1.4.0,0,label start method label end method
jruby-1.4.0,0,use array as is it liter array
jruby-1.4.0,0,let exact digit precis earlier loop
jruby-1.4.0,0,bench straight up integ fib
jruby-1.4.0,0,for arg onli signific maintain backward compat ast structur
jruby-1.4.0,0,bench integ fib
jruby-1.4.0,0,reset state
jruby-1.4.0,0,save packag modul ivar parent and add method parent don have come back here
jruby-1.4.0,0,obtain
jruby-1.4.0,0,line token constant
jruby-1.4.0,0,
jruby-1.4.0,0,comparison check check operand non null and non fals eqq call use onli it condit result case when begin rescu
jruby-1.4.0,0,fixm jrubi
jruby-1.4.0,0,store call inform method miss impl can use
jruby-1.4.0,0,use parent marshal
jruby-1.4.0,0,actual requir greater than rais error we don support actual requir
jruby-1.4.0,0,switch
jruby-1.4.0,0,initi size state stack valu stack current input token shift
jruby-1.4.0,0,tri load compil time constant refer thi might possibl constant defin and not forward refer valu that will defin later class
jruby-1.4.0,0,scope locat thi variabl high bit how mani scope down and low bit what index right scope set valu
jruby-1.4.0,0,
jruby-1.4.0,0,mri behavior week valu monoton so week that effect belong previou year will get valu not java
jruby-1.4.0,0,build scope name string
jruby-1.4.0,0,don bother
jruby-1.4.0,0,arg group use slower arg walk logic
jruby-1.4.0,0,for node not have their own scope pass null indic thi implement block evalu but they have scope just deal with thi lack scope throughout it lifespan should probabl chang way thi work get rid multipl null check
jruby-1.4.0,0,alway use gmt sinc that requir java api
jruby-1.4.0,0,explicitli use utf here use line asutf
jruby-1.4.0,0,remain argument script itself
jruby-1.4.0,0,eval each val val bar eval each val
jruby-1.4.0,0,line
jruby-1.4.0,0,except occur someth odd but possibl directori may return null
jruby-1.4.0,0,all done with lookup attempt releas monitor
jruby-1.4.0,0,select appropri call site dup receiv load self
jruby-1.4.0,0,yydefr
jruby-1.4.0,0,notifi call thread that we about sleep first time
jruby-1.4.0,0,tag addr eo
jruby-1.4.0,0,line
jruby-1.4.0,0,use number access method
jruby-1.4.0,0,keep refer temporari memori cach doe not get freed until struct freed
jruby-1.4.0,0,obtain
jruby-1.4.0,0,classid name class modul san where locat null then anonym class
jruby-1.4.0,0,here creat anonym except type use unrol stack mri creat new one everi call timeout which can costli opt use singl except type all case avoid thi overhead
jruby-1.4.0,0,mri ignor seek error presum unseek file like serial port jrubi shall too
jruby-1.4.0,0,final
jruby-1.4.0,0,start off with neutral parent
jruby-1.4.0,0,static privat final string translit translit
jruby-1.4.0,0,set valu rubyhash
jruby-1.4.0,0,doubl precis nativ
jruby-1.4.0,0,valu last token which had valu associ with it
jruby-1.4.0,0,obtain
jruby-1.4.0,0,renam success
jruby-1.4.0,0,not enough byte
jruby-1.4.0,0,special valu
jruby-1.4.0,0,must let origin string know we modifi share buffer aren damag
jruby-1.4.0,0,must least one digit strict
jruby-1.4.0,0,each root node ha top level scope that need push
jruby-1.4.0,0,switch more data strict calc
jruby-1.4.0,0,treat start and end start end end start end end
jruby-1.4.0,0,return
jruby-1.4.0,0,line
jruby-1.4.0,0,rubi ignor empti syswrit
jruby-1.4.0,0,specif ariti
jruby-1.4.0,0,push you look origin macro stack stack no chang
jruby-1.4.0,0,todo rb enc symnam
jruby-1.4.0,0,ad modul under constant name set that modul basenam constant name
jruby-1.4.0,0,common variabl method
jruby-1.4.0,0,not that load loop around resolv next pass
jruby-1.4.0,0,line
jruby-1.4.0,0,there suppli proc argument assum block suppli
jruby-1.4.0,0,more than local get local array too
jruby-1.4.0,0,limit each iter max bulk read size avoid over size alloc
jruby-1.4.0,0,should run thi pass current scope befor run nest scope
jruby-1.4.0,0,actualpath new reportedpath
jruby-1.4.0,0,not here but one should have been call thi anyway
jruby-1.4.0,0,open and coercion method rubi object via kernel
jruby-1.4.0,0,updat superclass refer
jruby-1.4.0,0,load alway use irubyobject simpl closur offset calcul here
jruby-1.4.0,0,yydgoto
jruby-1.4.0,0,onli thi case affect backref
jruby-1.4.0,0,method nil class nil
jruby-1.4.0,0,happen with nativ except should not filter those out
jruby-1.4.0,0,let rescuedblock continu
jruby-1.4.0,0,declar those compon bean bsf then will be possibl access those compon rubi global variabl frame menubar
jruby-1.4.0,0,let rescuedblock continu
jruby-1.4.0,0,repres dynam portion scope inform the variablevalu the valu assign local block variabl the staticscop identifi which sort of scope thi block local properti dynam scope static and dynam scope have same number name valu size variabl and thu name determin dure pars those structur do not need chang fixm when creat dynam scope sometim accident pass extra parent thi harmless other than wast memori but should not that can fix thi two way fix all caller check parent that pass and make new instanc local then it parent not local
jruby-1.4.0,0,bind eval
jruby-1.4.0,0,then just pass along window then pass along mac
jruby-1.4.0,0,write volatil
jruby-1.4.0,0,thi pretti ineffici build array just rais error someon use lot element
jruby-1.4.0,0,write volatil
jruby-1.4.0,0,tri load compil time constant refer thi might possibl constant defin and not forward refer valu that will defin later class
jruby-1.4.0,0,util method
jruby-1.4.0,0,tri load specifi name onli that fail tri defin class
jruby-1.4.0,0,util method
jruby-1.4.0,0,it singleton class and real class proc we do closur convers just use proc hashcod
jruby-1.4.0,0,write volatil
jruby-1.4.0,0,check thread event case we been woken die
jruby-1.4.0,0,write volatil
jruby-1.4.0,0,both writabl and writabl real through same method becaus our java process effect and real userid will alway same
jruby-1.4.0,0,write volatil
jruby-1.4.0,0,modul method
jruby-1.4.0,0,write volatil
jruby-1.4.0,0,remov executor task now avoid cancel task accumul until executor thread can schedul and remov them
jruby-1.4.0,0,write volatil
jruby-1.4.0,0,promis implement two with block
jruby-1.4.0,0,write volatil
jruby-1.4.0,0,but there superclass pass in use
jruby-1.4.0,0,boolean true file exist and writabl effect uid gid
jruby-1.4.0,0,fall through
jruby-1.4.0,0,noth fall back default compil below
jruby-1.4.0,0,call throwexcept via jrubi
jruby-1.4.0,0,assum ninit prec
jruby-1.4.0,0,add alias type nativetyp and ffi type
jruby-1.4.0,0,set scope awar true forc heap base local
jruby-1.4.0,0,normal file descriptor tri work with
jruby-1.4.0,0,noth fall back default compil below
jruby-1.4.0,0,rubygem too specif host cpu until have real need let default univers arch java
jruby-1.4.0,0,more than local get local array too
jruby-1.4.0,0,switch
jruby-1.4.0,0,invalid rang result empti string
jruby-1.4.0,0,close process output see jrubi hook parent process stdin caus problem irb etc use stdin
jruby-1.4.0,0,thi need unpack stuff
jruby-1.4.0,0,refresh call adapt sinc matter thi iter base not
jruby-1.4.0,0,add properti name alias
jruby-1.4.0,0,complet request fill read buffer first
jruby-1.4.0,0,rehash tabl threshold exceed
jruby-1.4.0,0,order array travers not import just intuit
jruby-1.4.0,0,alreadi confirm abov that length
jruby-1.4.0,0,there exactli one callback argument function then block can given and automat subsitut callback paramet
jruby-1.4.0,0,jrubymethod name new meta true visibl visibl privat
jruby-1.4.0,0,seem minimum which stat seek faster than realloc
jruby-1.4.0,0,rubi interpret compatibilti usag rubi switch programfil argument
jruby-1.4.0,0,defin env java
jruby-1.4.0,0,instanc method
jruby-1.4.0,0,thi point onli reach there except handler instal
jruby-1.4.0,0,jrubymethod name exact
jruby-1.4.0,0,termin and advanc buffer when find our char
jruby-1.4.0,0,jrubymethod name new meta true visibl visibl privat
jruby-1.4.0,0,there second argument simpli use work directori runtim
jruby-1.4.0,0,instanc method
jruby-1.4.0,0,irubyobject cacheentri threadcontext irubyobject irubyobject string arg
jruby-1.4.0,0,instanc method
jruby-1.4.0,0,wow onli time can use java protocol
jruby-1.4.0,0,intern variabl method
jruby-1.4.0,0,make sure key not alreadi hashtabl
jruby-1.4.0,0,more than local get local array too
jruby-1.4.0,0,check special shell charact begin and end each command word and don run process find them
jruby-1.4.0,0,should run thi pass current scope befor run nest scope
jruby-1.4.0,0,there someth valid sun path compon
jruby-1.4.0,0,tri lookup again under lock
jruby-1.4.0,0,base
jruby-1.4.0,0,symbol class method
jruby-1.4.0,0,thi while loop restart block call case fire
jruby-1.4.0,0,nest class whose instanc act thunk react to str method call from except to str except messag mri equival rb cnameerrormesg class name messag construct method to str implement todo thi class should not lookup
jruby-1.4.0,0,block from nil proc
jruby-1.4.0,0,set loader need reset class cach
jruby-1.4.0,0,make sure main stream set null
jruby-1.4.0,0,until get littl more solid support will onli run interpret mode
jruby-1.4.0,0,thi method intend onli defin new class rubi code use alloc specifi superclass default object alloc should not use defin class that requir nativ alloc
jruby-1.4.0,0,yysindex
jruby-1.4.0,0,first char must digit decim point
jruby-1.4.0,0,yygindex
jruby-1.4.0,0,bench fulli box fib
jruby-1.4.0,0,backspac
jruby-1.4.0,0,load target invoc
jruby-1.4.0,0,not reach
jruby-1.4.0,0,void method should work
jruby-1.4.0,0,verifi it there
jruby-1.4.0,0,difficult case send
jruby-1.4.0,0,els catch overs below
jruby-1.4.0,0,init
jruby-1.4.0,0,yygindex
jruby-1.4.0,0,switch
jruby-1.4.0,0,yygindex
jruby-1.4.0,0,
jruby-1.4.0,0,from commandlinepars
jruby-1.4.0,0,adjust buffer data
jruby-1.4.0,0,sqrt
jruby-1.4.0,0,switch while
jruby-1.4.0,0,packag privat
jruby-1.4.0,0,return valu thi operand fulli simplifi return operand form that can materi into bytecod cannot complet optim away the valu use dure optim and propag through ir but thrown away after that but operand form use construct compound object repres operand exampl getvalu getvalu note that all object and ha refer object and and ha refer so content modifi simplifi valu and also chang thi differ captur these two method
jruby-1.4.0,0,yysindex
jruby-1.4.0,0,if length not multipl we need pad last byte
jruby-1.4.0,0,yylen
jruby-1.4.0,0,int
jruby-1.4.0,0,sqrt
jruby-1.4.0,0,jrubi associ futur earli show thread list right away case doesn run immedi
jruby-1.4.0,0,increas precis next iter suppli exact digit
jruby-1.4.0,0,the datastruct place where custom inform can contain core implement that doesn necessarili want troubl creat subclass rubyobject the openssl implement use thi heavili save holder object contain java cryptographi object java integr use thi store java object ref protect transient object datastruct
jruby-1.4.0,0,initi reciproc
jruby-1.4.0,0,estim squar root with foremost bit squard and scale tandem
jruby-1.4.0,0,mri issus warn here rbignum len sizeof bdigit
jruby-1.4.0,0,function not use but get rid unus warn eclips we call those method from rubi they not realli unus
jruby-1.4.0,0,collect iter precis beforehand
jruby-1.4.0,0,skip thi one probabl window
jruby-1.4.0,0,just case add bit extra precis
jruby-1.4.0,0,block argument assign there block arg
jruby-1.4.0,0,gener number and precis check
jruby-1.4.0,0,run ten separ call into rubi with delay and explicit
jruby-1.4.0,0,kille thread same killer thread just die
jruby-1.4.0,0,wait until thread ha initi
jruby-1.4.0,0,the name thi sourc filenam foo rb
jruby-1.4.0,0,noth
jruby-1.4.0,0,note mri sqrt precis limit but allow valu more than
jruby-1.4.0,0,mri behavior rais argumenterror command befor check number arg
jruby-1.4.0,0,thi should onli call thi and rubyfil allow thi object creat without iohandl
jruby-1.4.0,0,calcul neg when specifi valu integ min valu mri use the equival of long neg val smaller valu biginteg math requir conform mri result
jruby-1.4.0,0,line
jruby-1.4.0,0,thi while loop restart block call case fire
jruby-1.4.0,0,sync flush
jruby-1.4.0,0,unread back
jruby-1.4.0,0,line
jruby-1.4.0,0,look classpath next we not use file test sinc unc name will match note jar resourc must never begin with previou code said alway begin with
jruby-1.4.0,0,note that addmethod now doe it own put ani chang made function here should made there well
jruby-1.4.0,0,
jruby-1.4.0,0,line
jruby-1.4.0,0,add forward refer from tgt currbb
jruby-1.4.0,0,yysindex
jruby-1.4.0,0,beneath rewritten coercion that reflect mri logic abov use onli rubybigdecim
jruby-1.4.0,0,empir appear that to ari coersion alway return array nil thi should alway array now
jruby-1.4.0,0,line
jruby-1.4.0,0,rethrow outer flow catcher
jruby-1.4.0,0,todo make now must power
jruby-1.4.0,0,thi is legal when remov undef
jruby-1.4.0,0,interrupt target thread case it block wait warn longer interrupt target thread sinc thi usual mean interrupt and with nio that mean channel longer usabl either need new way handl wake target thread that wait io need accept that can wake such thread and must wait them complet their oper
jruby-1.4.0,0,line
jruby-1.4.0,0,channeldescriptor open sysopen cach avoid collect
jruby-1.4.0,0,yyrindex
jruby-1.4.0,0,ensur have new interpret each test previou use same interpret which caus problem soon one test fail
jruby-1.4.0,0,yylen
jruby-1.4.0,0,don want packag name begin with dot remov them
jruby-1.4.0,0,not reach
jruby-1.4.0,0,make sure pipe stream set null
jruby-1.4.0,0,getfoo foo getfoo int foo int
jruby-1.4.0,0,callback fill method bodi
jruby-1.4.0,0,fals
jruby-1.4.0,0,make nil node bodi notic thi not part ast
jruby-1.4.0,0,not reach
jruby-1.4.0,0,fall through
jruby-1.4.0,0,return nil backtrac not array
jruby-1.4.0,0,rubi use qnil here use dummi becaus need class
jruby-1.4.0,0,it inner class and it not public can access it skip popul declar element
jruby-1.4.0,0,thi not closur break equival jump loop end label
jruby-1.4.0,0,not reach
jruby-1.4.0,0,not open default sinc file with read onli permiss will fail
jruby-1.4.0,0,not reach
jruby-1.4.0,0,bench long fib
jruby-1.4.0,0,current logic get here know that modul not there need fish out deleg but just case logic should chang later let anyway
jruby-1.4.0,0,leav normal array
jruby-1.4.0,0,not reach
jruby-1.4.0,0,switch object nativ type thi allow use defin class that have extend core nativ type piggyback their marshal logic
jruby-1.4.0,0,not reach
jruby-1.4.0,0,note can use file exist check whether symlink exist not becaus that method return fals exist but broken symlink so tri without exist check but tri catch block mri behavior symlink broken symlink should return true
jruby-1.4.0,0,not reach
jruby-1.4.0,0,case signatur sig object class object class object class object class object class break case signatur sig object class object class object class object class object class object class break
jruby-1.4.0,0,not reach
jruby-1.4.0,0,creat lightweight thunk
jruby-1.4.0,0,not reach
jruby-1.4.0,0,contain list all block as proc that should call when runtim environ exit
jruby-1.4.0,0,not reach
jruby-1.4.0,0,all posit power that can be repres exactli doubl float from
jruby-1.4.0,0,not reach
jruby-1.4.0,0,there might more test class singl file iter over them
jruby-1.4.0,0,not reach
jruby-1.4.0,0,silenc
jruby-1.4.0,0,rethrow except rethrow
jruby-1.4.0,0,onli whitespac allow after valu strict
jruby-1.4.0,0,thi need when enclos class modul singleton that case gener name such null foo which broke marshal among other the correct thing thi situat insert gener name form class xasdfasd it singleton modul class which thi code accomplish
jruby-1.4.0,0,digit error
jruby-1.4.0,0,thi onli case might null here in metaclass construct
jruby-1.4.0,0,don set permiss
jruby-1.4.0,0,error posit
jruby-1.4.0,0,get here class and field exist construct our unsaf impl that call directli
jruby-1.4.0,0,gener real method signatur method with to from coercion
jruby-1.4.0,0,wait signal
jruby-1.4.0,0,alreadi inspect there need regist unregist again
jruby-1.4.0,0,note intent return actual array return from java rather than wrap rubyarray wave futur when java class will return actual class rather than javaclass wrapper
jruby-1.4.0,0,done with closur compil
jruby-1.4.0,0,switch
jruby-1.4.0,0,line
jruby-1.4.0,0,add alia meta
jruby-1.4.0,0,snapshot content directori current posit directori
jruby-1.4.0,0,first char must digit decim point
jruby-1.4.0,0,while node could receiv non local flow control from ani these closur within loop eval within loop block arg base proc call within loop
jruby-1.4.0,0,channel alreadi close we longer valid
jruby-1.4.0,0,indic temp valu
jruby-1.4.0,0,head must not null and there must arg like arg
jruby-1.4.0,0,exclus lock java requir channel writabl otherwis except thrown termin jrubi execut but flock behavior mri that allow exclus lock even non writabl file convert exclus lock share lock channel not writabl better match mri behavior
jruby-1.4.0,0,append what read into our buffer and allow loop continu
jruby-1.4.0,0,zero arg block noth
jruby-1.4.0,0,don support so but some stdlib requir so directli replac with jar look extens type support
jruby-1.4.0,0,store previou except restor rescu someth
jruby-1.4.0,0,label start closur use implement redo label end closur use implement retri
jruby-1.4.0,0,specif version request use search
jruby-1.4.0,0,then deliv mail target
jruby-1.4.0,0,set self class
jruby-1.4.0,0,confirm minimum arg provid
jruby-1.4.0,0,public field method
jruby-1.4.0,0,predefin few other method invok directli elsewher
jruby-1.4.0,0,yyrindex
jruby-1.4.0,0,line token constant
jruby-1.4.0,0,noth
jruby-1.4.0,0,forc heap scope behavior sinc use parent scope
jruby-1.4.0,0,noth
jruby-1.4.0,0,don have bodi check requir opt arg opt arg they could have side effect requir arg need rais error too few arg pass otherwis method doe noth make nop
jruby-1.4.0,0,check visibl previou frame which will frame which class be eval
jruby-1.4.0,0,check visibl previou frame which will frame which class be eval
jruby-1.4.0,0,creat new entri
jruby-1.4.0,0,and given specif except
jruby-1.4.0,0,final with except
jruby-1.4.0,0,comput meet over all sourc and comput destin basic block that should then process sourc target depend direct data flow problem
jruby-1.4.0,0,todo vararg
jruby-1.4.0,0,bang true match substitut
jruby-1.4.0,0,todo vararg
jruby-1.4.0,0,onli whitespac allow after valu strict
jruby-1.4.0,0,accessor method
jruby-1.4.0,0,declar local java debug purpos
jruby-1.4.0,0,mri behavior
jruby-1.4.0,0,silent
jruby-1.4.0,0,mri behavior
jruby-1.4.0,0,check
jruby-1.4.0,0,not class
jruby-1.4.0,0,assert internednam internednam not intern
jruby-1.4.0,0,mri behavior
jruby-1.4.0,0,digit calc will return lax
jruby-1.4.0,0,rubi use qnil here use dummi becaus need class
jruby-1.4.0,0,loop until context avail clean softref that might have been collect
jruby-1.4.0,0,not class
jruby-1.4.0,0,pop extra fail valu from first cycl and we done
jruby-1.4.0,0,version inform
jruby-1.4.0,0,could not get canon path just use given path
jruby-1.4.0,0,line
jruby-1.4.0,0,char char cx with number cx
jruby-1.4.0,0,io avail onli return after eof encount need differenti between empti string and eof
jruby-1.4.0,0,the assumpt here that stream provid proper avail support avail alway return we hang
jruby-1.4.0,0,it less than median
jruby-1.4.0,0,store local var local variabl prepar class use previou scope
jruby-1.4.0,0,constant api method
jruby-1.4.0,0,let width if ani get process next loop ani lead get treat correctli
jruby-1.4.0,0,yysindex
jruby-1.4.0,0,class script defaultmethod class script defaultmethod
jruby-1.4.0,0,low level class variabl interfac fetch store list class variabl thi modul
jruby-1.4.0,0,posit within sourc must reflect actual offset and column sinc ate extra charact here thi account normal done read should updat posit info
jruby-1.4.0,0,read request hook read parent output
jruby-1.4.0,0,prepar loadservic and load path
jruby-1.4.0,0,use onli will set liter flag
jruby-1.4.0,0,and subtract neeed
jruby-1.4.0,0,step arg
jruby-1.4.0,0,digit arr shift updat all
jruby-1.4.0,0,yygindex
jruby-1.4.0,0,sss fixm can thi ever null
jruby-1.4.0,0,mri behavior just plain consid illeg window
jruby-1.4.0,0,numint also implement
jruby-1.4.0,0,what pass constructor method
jruby-1.4.0,0,instal direct java method with mangl name can call them directli
jruby-1.4.0,0,new
jruby-1.4.0,0,check visibl dup method
jruby-1.4.0,0,rubi instanc method
jruby-1.4.0,0,mri behavior default digit expon use digit onli when necessari see comment writeexp method more detail
jruby-1.4.0,0,constant tabl method pass deleg
jruby-1.4.0,0,exec need behav differ in process becaus it technic suppos replac call process we suppos run in process allow use default stream and not use pumper all see jrubi and jrubi
jruby-1.4.0,0,thi reli rubi round enumer java one which they current all
jruby-1.4.0,0,it either convert can make via abov logic it not one type convert just pass out as is without wrap
jruby-1.4.0,0,gotcha
jruby-1.4.0,0,now provid default impl number signatur for each ariti first gener non block version method which just add null block and re call allow compil code which alway can potenti take block onli gener block receiv signatur and still avoid arg box then provid default implement each block accept method that turn call irubyobject block version call thi then final fall back minimum implement requir dynam method handl
jruby-1.4.0,0,get canon path tri and flatten path out dir subdir should return cnutter want flatten path out
jruby-1.4.0,0,thi should onli call thi and rubyfil allow thi object creat without iohandl
jruby-1.4.0,0,cx
jruby-1.4.0,0,base
jruby-1.4.0,0,use command
jruby-1.4.0,0,default no flush
jruby-1.4.0,0,use command
jruby-1.4.0,0,line
jruby-1.4.0,0,push fals
jruby-1.4.0,0,mri behavior
jruby-1.4.0,0,fals zero
jruby-1.4.0,0,make sure ani read after close fail
jruby-1.4.0,0,pass block let check next outer frame one new
jruby-1.4.0,0,line
jruby-1.4.0,0,thi look wrong but it way mri doe it
jruby-1.4.0,0,futur compat constructor move toward not accept metaclass
jruby-1.4.0,0,proc class
jruby-1.4.0,0,note the indici here match exactli signal valu not reorder
jruby-1.4.0,0,rb exc new
jruby-1.4.0,0,visit label start scope local var thi method
jruby-1.4.0,0,mri behavior finish mode work pass through
jruby-1.4.0,0,zstream actual isn allocat
jruby-1.4.0,0,mri behavior enforc test
jruby-1.4.0,0,todo vararg
jruby-1.4.0,0,
jruby-1.4.0,0,dump usec not msec
jruby-1.4.0,0,handl rubi except raiseexcept
jruby-1.4.0,0,io finish
jruby-1.4.0,0,biginteg requir sign byte incom array
jruby-1.4.0,0,modifi match how hash calcul
jruby-1.4.0,0,retri handl rescu block
jruby-1.4.0,0,onli want object with valid stream better error now
jruby-1.4.0,0,float number second
jruby-1.4.0,0,defin class rubi but later want allow defin java alloc need updat
jruby-1.4.0,0,can just use dt sinc immut
jruby-1.4.0,0,produc nicer error sinc rubyist aren use see thi
jruby-1.4.0,0,for jdk can use
jruby-1.4.0,0,set with min valu and then add allow roll over
jruby-1.4.0,0,pad with
jruby-1.4.0,0,mri accept addit wday argument which appear ignor
jruby-1.4.0,0,might move thi time from dst dst offset assum same just befor last move from dst dst
jruby-1.4.0,0,bignorm here need
jruby-1.4.0,0,ignor usec arg for compat with parsed not suppli
jruby-1.4.0,0,time class method
jruby-1.4.0,0,valu will fit fixnum return one those
jruby-1.4.0,0,util method
jruby-1.4.0,0,mri issus warn here rbignum len sizeof bdigit
jruby-1.4.0,0,attempt decritic all we critic thread
jruby-1.4.0,0,depend io filetest
jruby-1.4.0,0,instanc method
jruby-1.4.0,0,
jruby-1.4.0,0,len margin
jruby-1.4.0,0,volatil ensur that initi nil fill visibl other thread
jruby-1.4.0,0,element and trail nil
jruby-1.4.0,0,plain intern array assign
jruby-1.4.0,0,dir tmpdir
jruby-1.4.0,0,valu
jruby-1.4.0,0,plain intern array assign
jruby-1.4.0,0,valu
jruby-1.4.0,0,rb ari new just alloc intern array
jruby-1.4.0,0,valu
jruby-1.4.0,0,plain intern array assign
jruby-1.4.0,0,newobj and objsetup equival fastest one share array option objectspac
jruby-1.4.0,0,pid
